{
  "$schema": "../catalog.schema.json",
  "name": "stx-fix",
  "slash": "/stx-fix",
  "version": "1.11.3",
  "zone": "main",
  "icon": "B",
  "terminal": {
    "group": "MAIN-BOUND",
    "lines": [
      "Two-agent QA → Coder loop for a known bug",
      "--autonomous skips the acceptance gate; --no-test skips the test (lint+build only)"
    ]
  },
  "card": {
    "summary": "Two-agent QA → Coder loop for a known bug. Failing test first, smallest change to make it pass. Writes a per-fix folder under <code>docs/waves/fix-{slug}/</code>. Personas live in <code>.claude/agents/</code>.",
    "paragraph": "QA → Coder loop against one reproducible bug. Interview → render prompt → user acceptance → loop. The Coder cannot edit test files; touching them halts the loop. On close-out, writes a per-fix folder under <code>docs/waves/fix-{slug}/</code> containing <code>fix-report.html</code> (human-readable summary) and <code>fix-state.json</code> (machine-readable record), plus refreshes the cross-fix index at <code>docs/waves/fix-wiki.html</code>. <code>--no-test</code> runs quick-fix mode: no QA agent, no test authored, no Playwright — the Coder's change is verified by <code>npm run lint</code> + <code>npm run build</code> + the repro, and the report records that the fix ships with no regression test.",
    "use_when": [
      "Reproducible bug with concrete URL/state/steps",
      "You want failing test first, then minimal fix",
      "Fix fits one worktree",
      "Small obvious fix where a test costs more than the bug → <code>--no-test</code>"
    ],
    "dontuse_when": [
      "Multiple acceptance criteria → <code>/stx-feature</code>",
      "Spans multiple tiers → <code>/stx-feature</code>",
      "You don't have a repro yet"
    ],
    "invocations": [
      { "comment": "Interactive", "cmd": "/stx-fix" },
      { "comment": "Pre-supply title", "cmd": "/stx-fix Timer offset wrong after DST" },
      { "comment": "Autonomous — skip acceptance gate; forces no-commit", "cmd": "/stx-fix <o>--autonomous</o> <o>--from</o> bug.yaml" },
      { "comment": "Quick fix — no test, no Playwright; lint + build + repro", "cmd": "/stx-fix <o>--no-test</o> Timer offset wrong after DST" },
      { "comment": "Both — no interview, no acceptance gate, no test", "cmd": "/stx-fix <o>--autonomous</o> <o>--no-test</o> <o>--from</o> bug.yaml" }
    ],
    "extras": [
      {
        "kind": "table",
        "title": "Required interview fields",
        "headers": ["Field", "Type", "Default"],
        "rows": [
          ["title", "text", "—"],
          ["issues", "numbered list", "—"],
          ["repro", "text", "—"],
          ["expected", "numbered list", "mirrors issues 1:1"],
          ["test_kind", "radio", "playwright (UI) / vitest-unit (logic) / none (--no-test)"],
          ["iteration_cap", "number", "5"],
          ["commit_policy", "radio", "commit-after-green"]
        ]
      },
      {
        "kind": "bullets",
        "title": "Artifacts produced (v1.3+)",
        "items": [
          "<code>docs/waves/fix-{slug}/fix-report.html</code> — per-fix human-readable report (one folder per fix, slug derived from the bug title)",
          "<code>docs/waves/fix-{slug}/fix-state.json</code> — per-fix machine-readable state record (iteration count, halt reason, files touched, test outcomes)",
          "<code>docs/waves/fix-wiki.html</code> — cross-fix index page linking every <code>fix-{slug}/</code> folder, regenerated on each close-out"
        ]
      },
      {
        "kind": "bullets",
        "title": "Halt conditions",
        "items": [
          "Coder edits a test file",
          "Coder edits an <em>existing</em> test file under <code>--no-test</code> — disabling a test is not a fix",
          "Coder weakens or skips an assertion",
          "Iteration cap trips (default 5)",
          "Lint/build fails for an unrelated reason",
          "Neither <code>--autonomous</code> nor <code>--no-test</code> bypasses any halt condition above — <code>--autonomous</code> only skips the acceptance gate and forces no-commit; <code>--no-test</code> only skips test authoring."
        ]
      }
    ]
  }
}
